<?xml version="1.0" encoding="UTF-8"?>
<CustomDataGrid xmlns="http://amdocs.com/flex/dashboard/customDataGrid/CustomDataGrid" 
                xmlns:xsi="http://www.w3.org/2001/XMLSchema-instance" 
                xsi:schemaLocation="http://amdocs.com/flex/dashboard/customDataGrid/CustomDataGrid ../xsd/CustomDataGrid.xsd"
                lockedColumnCount="1"
                version="1">
                
  <!-- <Column id="prdYear" dataField="prd_year" textAlign="center" visible="false" /> -->
  <Column id="catName" dataField="cat_name" headerLabel="Category" visible="true" />
  
  <Column id="ypAsgnAmt" dataField="yp_asgn_amt" headerLabel="Print Assigned Amt" visible="false" type="currency" fractionalDigits="0" />
  <Column id="ypHndlAmt" dataField="yp_hndl_amt" headerLabel="Print Handled Amt" visible="false" type="currency" fractionalDigits="0" />
  <Column id="ypSoldAmt" dataField="yp_sold_amt" headerLabel="Print Sold Amt" visible="false" type="currency" fractionalDigits="0" />
  <Column id="ypObj" dataField="yp_obj" headerLabel="Print Objective" visible="false" type="currency" fractionalDigits="0" />

  <Column id="iypAsgnAmt" dataField="iyp_asgn_amt" headerLabel="Internet Assigned Amt" visible="false" type="currency" fractionalDigits="0" />
  <Column id="iypHndlAmt" dataField="iyp_hndl_amt" headerLabel="Internet Handled Amt" visible="false" type="currency" fractionalDigits="0" />
  <Column id="iypSoldAmt" dataField="iyp_sold_amt" headerLabel="Internet Sold Amt" visible="false" type="currency" fractionalDigits="0" />
  <Column id="iypObj" dataField="iyp_obj" headerLabel="Internet Objective" visible="false" type="currency" fractionalDigits="0" />

  <Column id="asgnCnt" dataField="asgn_cnt" headerLabel="# Assigned" visible="true" type="number" />
  <Column id="asgnAmt" dataField="asgn_amt" headerLabel="Total Assigned Amt" visible="true" type="currency" fractionalDigits="0" />
  <Column id="hndlCnt" dataField="hndl_cnt" headerLabel="# Handled" visible="true" type="number" />
  <Column id="hndlAmt" dataField="hndl_amt" headerLabel="Total Handled Amt" visible="true" type="currency" fractionalDigits="0" />
  <Column id="soldCnt" dataField="sold_cnt" headerLabel="# Sold" visible="true" type="number" />
  <Column id="soldAmt" dataField="sold_amt" headerLabel="Total Sold Amt" visible="true" type="currency" fractionalDigits="0" />
  <Column id="obj" dataField="obj" headerLabel="Total Objective" visible="true" type="currency" fractionalDigits="0" />

  <Column id="renewalCnt" dataField="renewal_cnt" headerLabel="# Renewal" visible="true" type="number" />
  <Column id="renewalAmt" dataField="renewal_amt" headerLabel="Renewal Amt" visible="true" type="currency" fractionalDigits="0" />
  <Column id="increaseCnt" dataField="increase_cnt" headerLabel="# Increase" visible="true" type="number" />
  <Column id="increaseAmt" dataField="increase_amt" headerLabel="Increase Amt" visible="true" type="currency" fractionalDigits="0" />
  <Column id="decreaseCnt" dataField="decrease_cnt" headerLabel="# Decrease" visible="true" type="number" />
  <Column id="decreaseAmt" dataField="decrease_amt" headerLabel="Decrease Amt" visible="true" type="currency" fractionalDigits="0" />
  <Column id="cancelCnt" dataField="cancel_cnt" headerLabel="# Cancel" visible="true" type="number" />
  <Column id="cancelAmt" dataField="cancel_amt" headerLabel="Cancel Amt" visible="true" type="currency" fractionalDigits="0" />
  <Column id="oblCnt" dataField="obl_cnt" headerLabel="# OBL" visible="true" type="number" />
  <Column id="oblAmt" dataField="obl_amt" headerLabel="OBL Amt" visible="true" type="currency" fractionalDigits="0" />
  <Column id="newCnt" dataField="new_cnt" headerLabel="# New" visible="true" type="number" />
  <Column id="newAmt" dataField="new_amt" headerLabel="New Amt" visible="true" type="currency" fractionalDigits="0" />
  
</CustomDataGrid>
